<?xml version="1.0" encoding="UTF-8"?>
<?xml-stylesheet type="text/xsl" href="empstyle.xsl"?>
<company  xmlns:xsi="http://www.w3.org/2001/XMLSchema-instance" xsi:schemaLocation="empschema.xsd">
    <employee>
    <Emp-id>01</Emp-id>
    <Emp-name>Ronak Prasad</Emp-name>
    <Emp-age>21</Emp-age>
    <Emp-salary>60000</Emp-salary>
    <Emp-emailid>ronakprasad@gmail.com</Emp-emailid>
    <Emp-phonenum>9986449127</Emp-phonenum>
    <Emp-designation>Intern</Emp-designation>
    </employee>
</company>